{
  "artifact_retention_days": 30,
  "estimated_network_calls": 1,
  "expanded_scope": false,
  "fallback_policy": "registry_governed",
  "operation_count": 1,
  "partial_success_policy": "allowed",
  "planned_operations": [
    {
      "fallback_allowed": true,
      "operation_id": "op-TWSE:2330-FIXTURE_TEST_SOURCE",
      "operation_type": "current_snapshot",
      "source_family": "FIXTURE_TEST_SOURCE",
      "target_id": "TWSE:2330",
      "timing_class": "liveish_intraday_snapshot"
    }
  ],
  "planned_sources": [
    "FIXTURE_TEST_SOURCE"
  ],
  "preview_id": "preview-0c0bb48d8f4eac7c8266f7525124facb74f5fd670da5fc2fb2fe2ebb18c7eaf7",
  "request_id": "req-plugin-activation-8b531089-1286-486e-a852-c129b506ca81",
  "request_summary": "testing pre-registered plugin activation",
  "requires_user_confirmation": true,
  "schema_version": "m8r_phase_c_execution_preview.v1",
  "target_count": 1,
  "targets": [
    "TWSE:2330"
  ]
}
